{
  "$schema": "http://json-schema.org/draft-07/schema#",
  "type": "object",
  "properties": {
    "name": {
      "type": "object",
      "properties": {
        "first": {
          "type": "string"
        },
        "middle": {
          "type": "string"
        },
        "last": {
          "type": "string"
        }
      },
      "required": [
        "first",
        "middle",
        "last"
      ]
    },
    "photo": {
      "type": "string",
      "format": "uri"
    },
    "description": {
      "type": "string"
    },
    "contact": {
      "type": "object",
      "properties": {
        "phone": {
          "type": "string"
        },
        "email": {
          "type": "string",
          "format": "email"
        },
        "location": {
          "type": "object",
          "properties": {
            "city": {
              "type": "string"
            },
            "country": {
              "type": "string"
            }
          },
          "required": [
            "city",
            "country"
          ]
        },
        "website": {
          "type": "array",
          "items": {
            "type": "object",
            "properties": {
              "name": {
                "type": "string"
              },
              "uri": {
                "type": "string",
                "format": "uri"
              }
            },
            "required": [
              "name",
              "uri"
            ]
          }
        }
      },
      "required": [
        "phone",
        "email",
        "location",
        "website"
      ]
    },
    "education": {
      "type": "array",
      "items": {
        "type": "object",
        "properties": {
          "name": {
            "type": "string"
          },
          "location": {
            "type": "object",
            "properties": {
              "city": {
                "type": "string"
              },
              "country": {
                "type": "string"
              }
            },
            "required": [
              "city",
              "country"
            ]
          },
          "degree": {
            "type": "string"
          },
          "major": {
            "type": "string"
          },
          "interval": {
            "type": "object",
            "properties": {
              "start": {
                "type": "string",
                "format": "date"
              },
              "end": {
                "type": [
                  "string",
                  "null"
                ],
                "format": "date"
              }
            },
            "required": [
              "start",
              "end"
            ]
          }
        },
        "required": [
          "name",
          "location",
          "degree",
          "major",
          "interval"
        ]
      }
    },
    "work": {
      "type": "array",
      "items": {
        "type": "object",
        "properties": {
          "name": {
            "type": "string"
          },
          "position": {
            "type": "string"
          },
          "interval": {
            "type": "object",
            "properties": {
              "start": {
                "type": "string",
                "format": "date"
              },
              "end": {
                "type": [
                  "string",
                  "null"
                ],
                "format": "date"
              }
            },
            "required": [
              "start",
              "end"
            ]
          },
          "lines": {
            "type": "array",
            "items": {
              "type": "string"
            }
          },
          "skills": {
            "type": "array",
            "items": {
              "type": "string"
            }
          }
        },
        "required": [
          "name",
          "position",
          "interval",
          "lines",
          "skills"
        ]
      }
    },
    "languages": {
      "type": "array",
      "items": {
        "type": "object",
        "properties": {
          "name": {
            "type": "string"
          },
          "level": {
            "type": "string"
          }
        },
        "required": [
          "name",
          "level"
        ]
      }
    },
    "skills": {
      "type": "array",
      "items": {
        "type": "string"
      }
    },
    "technologies": {
      "type": "object",
      "properties": {
        "languages": {
          "type": "array",
          "items": {
            "type": "string"
          }
        },
        "others": {
          "type": "array",
          "items": {
            "type": "string"
          }
        }
      },
      "required": [
        "languages",
        "others"
      ]
    },
    "projects": {
      "type": "array",
      "items": {
        "type": "object",
        "properties": {
          "name": {
            "type": "string"
          },
          "description": {
            "type": "string"
          },
          "uri": {
            "type": "string",
            "format": "uri"
          }
        }
      }
    }
  },
  "required": [
    "name",
    "photo",
    "description",
    "contact",
    "education",
    "work",
    "languages",
    "skills",
    "technologies",
    "projects"
  ]
}
